{
  "comparison_quality": {
    "alignment_status": "unavailable",
    "clean_reference_run_ids": [],
    "conditions_scope": "No aligned representative comparison in this synthetic unavailable-state case",
    "limitations": [
      "No aligned comparison is available; exact numeric target traces are prohibited."
    ],
    "optimality_claim_allowed": false,
    "representative_lap_status": "unavailable",
    "setup_fingerprint_match": false,
    "setup_scope": "different_or_unknown",
    "source_reference_ids": [],
    "status": "unusable"
  },
  "fixture_metadata": {
    "production_use_allowed": false,
    "purpose": "Unavailable geometry, comparison, target, steering-angle, and groove UI states",
    "real_driver_or_setup_data": false,
    "synthetic": true,
    "visible_watermark": "SYNTHETIC UI FIXTURE - NOT DRIVING ADVICE"
  },
  "groove": {
    "claim_label": "Groove direction unavailable",
    "directional_labels_supported": false,
    "geometry_calibration_status": "unavailable",
    "limitation": "Inside/outside geometry is not calibrated; path movement cannot be labeled as a groove.",
    "optimality_claim_allowed": false,
    "recommendations": [],
    "status": "unavailable"
  },
  "identity": {
    "car_name": "NASCAR Test Car",
    "is_fixed_setup": false,
    "track_config": "Oval",
    "track_name": "Synthetic Speedway"
  },
  "interruptions": [],
  "limitations": [
    "Synthetic UI fixture with no real track geometry or driver/setup data.",
    "Only an early observed-local phase is supported; all other tire-age positions are unavailable.",
    "No exact target, directional groove, or signed steering-angle claim is allowed."
  ],
  "phase_slider": {
    "continuous_interpolation_supported": false,
    "mode": "snap-to-supported-phases",
    "tire_age_interpretation": "green_laps_on_set_proxy",
    "unsupported_green_lap_ranges": [
      [
        1,
        1
      ],
      [
        9,
        27
      ]
    ],
    "values": [
      {
        "caution_laps_on_set": 0,
        "evidence_class": "proxy",
        "green_lap_bounds": [
          2,
          8
        ],
        "key": "early",
        "label": "Early",
        "measured_tire_wear_available": false,
        "source_lap_numbers": [
          2,
          3,
          4,
          5,
          6,
          7,
          8
        ],
        "source_run_id": "synthetic-local-run-001",
        "tire_set_id": "synthetic-local-tire-set-001"
      }
    ]
  },
  "phase_traces": [
    {
      "evidence_class": "derived",
      "phase_key": "early",
      "samples": [
        {
          "brake": 0.0,
          "lap_pct": 0.004167,
          "speed_mph": 152.0,
          "steering_work_abs_rad": 0.025,
          "throttle": 1.0
        },
        {
          "brake": 0.0,
          "lap_pct": 0.0125,
          "speed_mph": 152.0,
          "steering_work_abs_rad": 0.025,
          "throttle": 1.0
        },
        {
          "brake": 0.0,
          "lap_pct": 0.020833,
          "speed_mph": 152.0,
          "steering_work_abs_rad": 0.025,
          "throttle": 1.0
        },
        {
          "brake": 0.0,
          "lap_pct": 0.029167,
          "speed_mph": 152.0,
          "steering_work_abs_rad": 0.025,
          "throttle": 1.0
        },
        {
          "brake": 0.0,
          "lap_pct": 0.0375,
          "speed_mph": 150.41,
          "steering_work_abs_rad": 0.0329,
          "throttle": 0.9686
        },
        {
          "brake": 0.0,
          "lap_pct": 0.045833,
          "speed_mph": 148.01,
          "steering_work_abs_rad": 0.045,
          "throttle": 0.9212
        },
        {
          "brake": 0.0,
          "lap_pct": 0.054167,
          "speed_mph": 145.64,
          "steering_work_abs_rad": 0.0568,
          "throttle": 0.8746
        },
        {
          "brake": 0.0,
          "lap_pct": 0.0625,
          "speed_mph": 143.32,
          "steering_work_abs_rad": 0.0684,
          "throttle": 0.8287
        },
        {
          "brake": 0.0,
          "lap_pct": 0.070833,
          "speed_mph": 141.05,
          "steering_work_abs_rad": 0.0797,
          "throttle": 0.7839
        },
        {
          "brake": 0.0411,
          "lap_pct": 0.079167,
          "speed_mph": 138.83,
          "steering_work_abs_rad": 0.0908,
          "throttle": 0.7278
        },
        {
          "brake": 0.0556,
          "lap_pct": 0.0875,
          "speed_mph": 136.68,
          "steering_work_abs_rad": 0.1016,
          "throttle": 0.681
        },
        {
          "brake": 0.0699,
          "lap_pct": 0.095833,
          "speed_mph": 134.6,
          "steering_work_abs_rad": 0.112,
          "throttle": 0.6355
        },
        {
          "brake": 0.0839,
          "lap_pct": 0.104167,
          "speed_mph": 132.58,
          "steering_work_abs_rad": 0.1221,
          "throttle": 0.5916
        },
        {
          "brake": 0.0978,
          "lap_pct": 0.1125,
          "speed_mph": 130.65,
          "steering_work_abs_rad": 0.1317,
          "throttle": 0.5493
        },
        {
          "brake": 0.1114,
          "lap_pct": 0.120833,
          "speed_mph": 128.8,
          "steering_work_abs_rad": 0.141,
          "throttle": 0.5087
        },
        {
          "brake": 0.1247,
          "lap_pct": 0.129167,
          "speed_mph": 127.04,
          "steering_work_abs_rad": 0.1498,
          "throttle": 0.4701
        },
        {
          "brake": 0.1377,
          "lap_pct": 0.1375,
          "speed_mph": 125.38,
          "steering_work_abs_rad": 0.1581,
          "throttle": 0.4333
        },
        {
          "brake": 0.1502,
          "lap_pct": 0.145833,
          "speed_mph": 123.82,
          "steering_work_abs_rad": 0.1659,
          "throttle": 0.3987
        },
        {
          "brake": 0.1624,
          "lap_pct": 0.154167,
          "speed_mph": 122.35,
          "steering_work_abs_rad": 0.1732,
          "throttle": 0.3662
        },
        {
          "brake": 0.1741,
          "lap_pct": 0.1625,
          "speed_mph": 121.0,
          "steering_work_abs_rad": 0.18,
          "throttle": 0.3359
        },
        {
          "brake": 0.1853,
          "lap_pct": 0.170833,
          "speed_mph": 119.76,
          "steering_work_abs_rad": 0.1862,
          "throttle": 0.308
        },
        {
          "brake": 0.1961,
          "lap_pct": 0.179167,
          "speed_mph": 118.63,
          "steering_work_abs_rad": 0.1919,
          "throttle": 0.2825
        },
        {
          "brake": 0.2063,
          "lap_pct": 0.1875,
          "speed_mph": 117.62,
          "steering_work_abs_rad": 0.1969,
          "throttle": 0.2595
        },
        {
          "brake": 0.2159,
          "lap_pct": 0.195833,
          "speed_mph": 116.72,
          "steering_work_abs_rad": 0.2014,
          "throttle": 0.239
        },
        {
          "brake": 0.2249,
          "lap_pct": 0.204167,
          "speed_mph": 115.96,
          "steering_work_abs_rad": 0.2052,
          "throttle": 0.2211
        },
        {
          "brake": 0.2333,
          "lap_pct": 0.2125,
          "speed_mph": 115.31,
          "steering_work_abs_rad": 0.2084,
          "throttle": 0.2059
        },
        {
          "brake": 0.2411,
          "lap_pct": 0.220833,
          "speed_mph": 114.8,
          "steering_work_abs_rad": 0.211,
          "throttle": 0.1934
        },
        {
          "brake": 0.2482,
          "lap_pct": 0.229167,
          "speed_mph": 114.41,
          "steering_work_abs_rad": 0.213,
          "throttle": 0.1835
        },
        {
          "brake": 0.2547,
          "lap_pct": 0.2375,
          "speed_mph": 114.15,
          "steering_work_abs_rad": 0.2143,
          "throttle": 0.1765
        },
        {
          "brake": 0.2604,
          "lap_pct": 0.245833,
          "speed_mph": 114.02,
          "steering_work_abs_rad": 0.2149,
          "throttle": 0.1722
        },
        {
          "brake": 0.2654,
          "lap_pct": 0.254167,
          "speed_mph": 114.02,
          "steering_work_abs_rad": 0.2149,
          "throttle": 0.1707
        },
        {
          "brake": 0.2697,
          "lap_pct": 0.2625,
          "speed_mph": 114.15,
          "steering_work_abs_rad": 0.2143,
          "throttle": 0.172
        },
        {
          "brake": 0.2733,
          "lap_pct": 0.270833,
          "speed_mph": 114.41,
          "steering_work_abs_rad": 0.213,
          "throttle": 0.176
        },
        {
          "brake": 0.2761,
          "lap_pct": 0.279167,
          "speed_mph": 114.8,
          "steering_work_abs_rad": 0.211,
          "throttle": 0.1829
        },
        {
          "brake": 0.2782,
          "lap_pct": 0.2875,
          "speed_mph": 115.31,
          "steering_work_abs_rad": 0.2084,
          "throttle": 0.1925
        },
        {
          "brake": 0.2795,
          "lap_pct": 0.295833,
          "speed_mph": 115.96,
          "steering_work_abs_rad": 0.2052,
          "throttle": 0.2048
        },
        {
          "brake": 0.28,
          "lap_pct": 0.304167,
          "speed_mph": 116.72,
          "steering_work_abs_rad": 0.2014,
          "throttle": 0.2198
        },
        {
          "brake": 0.2797,
          "lap_pct": 0.3125,
          "speed_mph": 117.62,
          "steering_work_abs_rad": 0.1969,
          "throttle": 0.2374
        },
        {
          "brake": 0.2787,
          "lap_pct": 0.320833,
          "speed_mph": 118.63,
          "steering_work_abs_rad": 0.1919,
          "throttle": 0.2577
        },
        {
          "brake": 0.277,
          "lap_pct": 0.329167,
          "speed_mph": 119.76,
          "steering_work_abs_rad": 0.1862,
          "throttle": 0.2805
        },
        {
          "brake": 0.2744,
          "lap_pct": 0.3375,
          "speed_mph": 121.0,
          "steering_work_abs_rad": 0.18,
          "throttle": 0.3058
        },
        {
          "brake": 0.2711,